Name,Link,Up,Down
VS Code Extension: New Remote Development Pack introduced,https://medium.com/@billys.moustakas/vs-code-extension-new-remote-development-pack-introduced-fe3730dde771,3,0
"Koji is a platform that makes building and deploying full-stack web apps dramatically faster, and easier.",https://gokoji.com/,5,0
Licia: Useful Utility Collection with Zero Dependencies:),https://licia.liriliri.io/,1,0
PCI DSS for “Blockchain Based” Crypto Projects,https://2muchcoffee.com/blog/pci-dss-for-crypto-projects-blockchain-based/,1,0
Node.js TypeScript #12. Introduction to Worker Threads with TypeScript,https://wanago.io/2019/05/06/node-js-typescript-12-worker-threads/,1,0
Open source full-stack solution for fast PWA development,https://bento-starter.netlify.com/,1,0
Build a Modern Chat Application with React,https://www.cometchat.com/tutorials/build-a-modern-chat-application-with-react/,1,0
Angular JS chat tutorial: Anonymous group chat,https://www.cometchat.com/tutorials/build-an-anonymous-group-chat-with-angular-7/,1,0
EchoJS Vacation Notice,/news/31674,8,1
5 things you didn’t know about React DevTools,https://blog.logrocket.com/5-things-you-didnt-know-about-react-devtools-2c6e0ef22529,6,0
A horrifying globalThis polyfill in universal JavaScript,https://mathiasbynens.be/notes/globalthis,1,0
Getting Started With React Redux Using React,https://www.js-tutorials.com/react-js/getting-started-with-react-redux-example-using-react/,1,0
Npm module that returns user's social network avatar without need of token or API keys,https://github.com/eldimious/network-avatar-picker,1,0
Introduction to Angular Grid,https://techshard.com/2019/05/05/introduction-to-angular-grid/,1,0
"Terminal based 404 page with jargon, wikipedia, github and rfc commands",https://terminal.jcubic.pl/404,2,0
Image recognition with React & ONNX.js - On Web,https://heartbeat.fritz.ai/building-an-image-recognition-app-using-onnx-js-c7147f4f291b,3,0
Combination of React and D3,https://medium.com/@icrosil/combination-of-react-and-d3-1fb07b00fb55,2,0
React Hooks/Suspense and a Functional Programming: Hooks/Suspense as Applicative/Monadic syntax,https://medium.freecodecamp.org/when-to-use-react-suspense-vs-react-hooks-f66ef94cb54f,2,0
"A Starter Project for Building Distributed, Message Based Node Apps",https://github.com/node-ts/bus-starter,2,0
React Navigation vs. React Native Navigation: Which is right for you?,https://blog.logrocket.com/react-navigation-vs-react-native-navigation-which-is-right-for-you-3d47c1cd1d63,3,0
Node Express Analytics Dashboard with Cube.js,https://cube.dev/blog/node-express-analytics-dashboard-with-cubejs/,3,0
10 JavaScript Charting Libraries for Every Data Visualization Need,https://hackernoon.com/10-javascript-charting-libraries-data-visualization-b77523d23372,3,0
Facebook makes its first browser API contribution,https://techcrunch.com/2019/04/22/facebook-makes-its-first-browser-api-contribution/,8,0
Introduction to Vue Render Functions (w/ examples),https://snipcart.com/blog/vue-render-functions,2,0
React: JSX & Rendering,https://itnext.io/react-jsx-rendering-4405d3a3d6c3,3,0
How to Write Node.Js Applications in Typescript,https://medium.com/@freek_mencke/how-to-write-node-js-applications-in-typescript-a54af696f66?source=friends_link&amp;sk=2576a44b4fed8e1a49c2513fc2ac0fd3,1,0
Redux Agent · Reducer-driven effects for React/Redux apps,https://redux-agent.org,1,0
LIPS Is Pretty Simple - lisp in JavaScript with full macro support,https://jcubic.github.io/lips/,1,0
Using Boxing to prevent distribution of conditional types in typescript,https://lorefnon.tech/2019/05/02/using-boxing-to-prevent-distribution-of-conditional-types/,1,0
A better strategy for long term caching,https://medium.com/@sujankanwar/a-better-strategy-for-long-term-caching-d41f3c63cb74?source=friends_link&sk=e714b2838a48b83a7fa90377faed8e54,1,0
